{
  "$schema": "http://json-schema.org/draft-07/schema#",
  "additionalProperties": true,
  "properties": {
    "architecture_class": {
      "type": "string"
    },
    "model_id": {
      "type": "string"
    },
    "role_count": {
      "type": "integer"
    },
    "roles": {
      "type": "array"
    },
    "schema": {
      "const": "boltbeam.weight_inventory.v1"
    },
    "source": {
      "type": "string"
    },
    "total_known_weight_bytes": {
      "type": "integer"
    },
    "unknown_quant_roles": {
      "type": "array"
    }
  },
  "required": [
    "architecture_class",
    "model_id",
    "role_count",
    "roles",
    "schema",
    "source",
    "total_known_weight_bytes",
    "unknown_quant_roles"
  ],
  "title": "boltbeam weight_inventory contract (top-level shape, generated from a real artifact; LN-100)",
  "type": "object"
}
